{
  "authorization": {
    "does_not_grant": [
      "publish chart rankings",
      "publish content",
      "contact artists or managers",
      "modify subscriber state"
    ],
    "grants": [
      "publish this event to the stream"
    ],
    "note": "Receiving this event authorizes nothing beyond reading it. Publishing authority is never conferred by event receipt."
  },
  "cost": {
    "browser_tasks": 2,
    "note": "Per the cost-accounting principle: every automated operation records its cost. Units to be standardized when the stream goes live."
  },
  "event_id": "evt-20261012-001",
  "event_type": "music.baseline.updated",
  "idempotency_key": "music.baseline.updated:2026-10-12:week1",
  "payload": {
    "artists_tracked": 5,
    "baseline_week": 1,
    "charts": [
      "Gen Alpha Weekly Top 10 (songs)",
      "Gen Alpha Rising Stars (artists)"
    ],
    "snapshot_refs": [
      "events/pilot/evidence/2026-10-12-raw.json",
      "events/pilot/evidence/2026-10-12-youtube.json"
    ],
    "songs_tracked": 16
  },
  "provenance": {
    "collection_method": "read-only browser collection; no logins, no posts, no changes",
    "collection_window_et": "2026-10-12T01:28-02:00",
    "created_at": "2026-10-12T06:00:00Z",
    "created_by": "finch",
    "evidence": [
      {
        "description": "Artist-level baseline: Spotify monthly listeners, TikTok/IG followers, playlist status",
        "ref": "events/pilot/evidence/2026-10-12-raw.json",
        "type": "snapshot",
        "scope": "repo-relative; resolves for any consumer of this repository"
      },
      {
        "description": "Song-level baseline: YouTube views/likes/comments for all 16 songs, verified video IDs",
        "ref": "events/pilot/evidence/2026-10-12-youtube.json",
        "type": "snapshot",
        "scope": "repo-relative; resolves for any consumer of this repository"
      },
      {
        "description": "Permanent artist (gal-a-NNN) and song (gal-s-NNN) IDs",
        "ref": "events/pilot/evidence/chart-registry.json",
        "type": "registry",
        "scope": "repo-relative; resolves for any consumer of this repository"
      },
      {
        "description": "Chart methodology v1.3",
        "ref": "events/pilot/evidence/chart-methodology-v1.3.md",
        "type": "methodology",
        "scope": "repo-relative; resolves for any consumer of this repository"
      }
    ],
    "role": "research & data"
  },
  "published_at": "2026-10-12T06:00:00Z",
  "publisher": "finch",
  "schema_version": "1",
  "status": "drafted \u2014 awaiting subscriber implementation on Athena side",
  "subscriber_test_plan": [
    "Athena receives event, retrieves referenced snapshots, validates figures against sources, acknowledges receipt",
    "Duplicate delivery: same idempotency_key delivered twice \u2014 handler must not double-apply",
    "Offline subscriber: event queued, delivered on wake",
    "Invalid evidence reference: subscriber flags, does not silently accept"
  ]
}